{
  "$schema": "http://json-schema.org/draft-07/schema#",
  "title": "Generated schema for BusinessActionList",
  "type": "array",
  "items": {
    "type": "object",
    "properties": {
      "Header": {
        "type": "string"
      },
      "TaskCode": {
        "type": "string"
      },
      "IsActive": {
        "type": "boolean"
      },
      "SubTasks1": {
        "type": "array",
        "items": {
          "type": "object",
          "properties": {
            "Header": {
              "type": "string"
            },
            "IsActive": {
              "type": "boolean"
            },
            "TaskCode": {
              "type": "string"
            },
            "SubTasks2": {
              "type": "array",
              "items": {
                "type": "object",
                "properties": {
                  "Header": {
                    "type": "string"
                  },
                  "TaskCode": {
                    "type": "string"
                  },
                  "IsActive": {
                    "type": "boolean"
                  }
                },
                "required": [
                  "Header",
                  "TaskCode",
                  "IsActive"
                ]
              }
            }
          },
          "required": [
            "Header",
            "IsActive",
            "TaskCode",
            "SubTasks2"
          ]
        }
      }
    },
    "required": [
      "Header",
      "TaskCode",
      "IsActive",
      "SubTasks1"
    ]
  }
}